<?xml version="1.0"?>
<!DOCTYPE Report
[
<!ELEMENT Report (General ,(Doc|BPT)) >
<!ATTLIST Report ver CDATA #REQUIRED tmZone CDATA #REQUIRED>

<!ELEMENT General ( DocLocation ) >
<!ATTLIST General productName CDATA #REQUIRED productVer CDATA #REQUIRED os CDATA #REQUIRED host CDATA #REQUIRED qcserver CDATA #IMPLIED qcproject CDATA #IMPLIED SolManSolutionId CDATA #IMPLIED SolManProjectId CDATA #IMPLIED SolManTestPlanId CDATA #IMPLIED SolManTestPackageId CDATA #IMPLIED SolManUserInfoData CDATA #IMPLIED  >

<!ELEMENT BPT (DName,Res,DVer?,TSet?,TInst?,NodeArgs,AdditionalInfo*,Doc*) >
<!ATTLIST BPT rID ID #REQUIRED >

<!ELEMENT Doc (DName,ConfName?,Res,DVer?,TSet?,TInst?,RunType?,DT?,AdditionalInfo*,Step*,DIter*,Step*,Action*,Doc*,Summary?,TestMaintenanceSummary*,NodeArgs?) >
<!ATTLIST Doc rID ID #REQUIRED type (Test|BC|BPTWrapperTest|Flow|Group|Action) "Test" productName CDATA #REQUIRED BCIter CDATA #IMPLIED >

<!ELEMENT RunType ( #PCDATA )>
<!ATTLIST RunType fmStep (False|True) "False" batch (False|True) "False" upDesc (False|True) "False" upChk (False|True) "False" upAS (False|True) "False">

<!ELEMENT DName ( #PCDATA ) >

<!ELEMENT ConfName ( #PCDATA ) >

<!ELEMENT Res ( #PCDATA ) >

<!ELEMENT AdditionalInfo (AdditionalDataName,AdditionalDataValue ) >

<!ELEMENT AdditionalDataName ( #PCDATA ) >

<!ELEMENT AdditionalDataValue ( #PCDATA ) >

<!ELEMENT DVer ( #PCDATA ) >

<!ELEMENT TSet ( #PCDATA ) >

<!ELEMENT TInst ( #PCDATA ) >

<!ELEMENT DIter (Step*,Action+,Summary?,NodeArgs)>
<!ATTLIST DIter rID ID #REQUIRED iterID CDATA #REQUIRED>

<!ELEMENT DocLocation ( #PCDATA )>

<!ELEMENT Action (AName,AIter*,(Step|HtmlStep|Action)*, Summary,ActionMaintenanceSummary*, NodeArgs ) >
<!ATTLIST Action rID ID #REQUIRED>

<!ELEMENT AIter ((Step|HtmlStep|Action)*,DataMapping?, Summary?,NodeArgs) >
<!ATTLIST AIter rID ID #REQUIRED iterID CDATA #REQUIRED isCountable (False|True) "False" >

<!ELEMENT AName ( #PCDATA ) >

<!ELEMENT TestMaintenanceSummary (ActionMaintenanceSummary*) >
<!ATTLIST TestMaintenanceSummary ObjectsAdded CDATA #REQUIRED ObjectsUpdated CDATA #REQUIRED StepsUpdated CDATA #REQUIRED StepsComments CDATA #REQUIRED><!ELEMENT ActionMaintenanceSummary (ObjectChange* ) >
<!ATTLIST ActionMaintenanceSummary Action CDATA #REQUIRED Objects CDATA #REQUIRED Updated CDATA #REQUIRED LinesTotal CDATA #REQUIRED Added CDATA #REQUIRED LinesUpdated CDATA #REQUIRED>

<!ELEMENT ObjectChange  (Hierarchy, PropertyChangeList* ) >
<!ATTLIST ObjectChange Operation CDATA #IMPLIED OriginalRepository CDATA #IMPLIED>

<!ELEMENT PropertyChangeList (PropertyDef*) >

<!ELEMENT PropertyDef (OriginalValue, NewValue) >
<!ATTLIST PropertyDef PropName CDATA #REQUIRED OriginRegularExpression (True|False) "False" NewRegularExpression (True|False) "False" AddedProperty (True|False) "False" >

<!ELEMENT OriginalValue ( #PCDATA )>

<!ELEMENT NewValue ( #PCDATA )>

<!ELEMENT Hierarchy  (ObjectName, Hierarchy*) >
<!ATTLIST Hierarchy MicClass CDATA #REQUIRED>

<!ELEMENT ObjectName  ( #PCDATA ) >

<!ELEMENT Step (Obj,Details,Time,TimeTick* ,(Step|HtmlStep|Doc)*, DataMapping?, NodeArgs) >
<!ATTLIST Step rID ID #REQUIRED retval CDATA #IMPLIED>

<!ELEMENT HtmlStep (HTML,TimeTick*,(Step|HtmlStep|Doc)*,NodeArgs) >
<!ATTLIST HtmlStep rID ID #REQUIRED >

<!ELEMENT Obj ( #PCDATA ) >
<!ATTLIST Obj plainTxt (False|True) "True">

<!ELEMENT Details ( #PCDATA ) >
<!ATTLIST Details plainTxt (False|True) "True">

<!ELEMENT Time ( #PCDATA ) >

<!ELEMENT HTML ( #PCDATA ) >

<!ELEMENT Disp ( #PCDATA ) >

<!ELEMENT TimeTick ( #PCDATA ) >

<!ELEMENT DataMapping ( DataMappedItem* )>
<!ELEMENT DataMappedItem EMPTY >
<!ATTLIST DataMappedItem dsName CDATA #REQUIRED >
<!ATTLIST DataMappedItem rowId CDATA #REQUIRED >

<!ELEMENT NodeArgs (Disp,TopPane?,BtmPane?,ExtendedInfo? )>
<!ATTLIST NodeArgs eType CDATA #REQUIRED icon CDATA #REQUIRED nRep CDATA #REQUIRED UserNote CDATA #IMPLIED filter (False|True) "True">
<!ATTLIST NodeArgs status (Passed|Failed|Done|Warning|Information) "Done">
<!ATTLIST NodeArgs iconSel CDATA #IMPLIED nType CDATA #IMPLIED MovieMarker CDATA "">
<!ATTLIST NodeArgs Source CDATA #IMPLIED SourceLine CDATA #IMPLIED StepFlowItemKey CDATA #IMPLIED >

<!ELEMENT TopPane (Path)>

<!ELEMENT BtmPane ( (Path|WR)?,ASHilite?)>
<!ATTLIST BtmPane vType CDATA "HTML">

<!ELEMENT Path ( #PCDATA ) >

<!ELEMENT ASHilite ( #PCDATA ) >

<!ELEMENT WR ( #PCDATA ) >

<!ELEMENT ExtendedInfo ( StepData ) >

<!ATTLIST ExtendedInfo StepType CDATA #REQUIRED>
<!ELEMENT DT (NodeArgs) >
<!ATTLIST DT rID ID #REQUIRED>

<!ELEMENT Summary (Param*)>
<!ATTLIST Summary sTime CDATA #IMPLIED eTime CDATA #IMPLIED passed CDATA #IMPLIED failed CDATA #IMPLIED warnings CDATA #IMPLIED retval CDATA #IMPLIED stopped (False|True) "False" >

<!ELEMENT Param (ParamName,ParamVal)+ >
<!ATTLIST Param paramInOut (In|Out) "In">

<!ELEMENT ParamName ( #PCDATA ) >

<!ELEMENT ParamVal ( #PCDATA ) >

]
>
<Report ver="2.0" tmZone="India Standard Time">
<General productName="HPE Unified Functional Testing" productVer="14.03" os="" host="DESKTOP-GH8JCFT"><DocLocation><![CDATA[C:\Users\Admin\Desktop\Capgemini Study Material\Keyboard_driven_framework\Driver\Driver]]></DocLocation></General>
<Doc rID="T1"   productName= "HPE Unified Functional Testing"  >
<DName><![CDATA[Driver]]></DName>
<Res><![CDATA[Res27]]></Res>
<DT rID="T2">
<NodeArgs eType="Table" icon="2" nRep="4" filter="False" >
<Disp><![CDATA[Run-Time Data Table]]></Disp>
<BtmPane vType="Table" >
<Path><![CDATA[Default.xls]]></Path>
</BtmPane>
</NodeArgs>
</DT>
<Action rID="T3">
<AName><![CDATA[Action1]]></AName>
<Step rID="T4">
<Obj plainTxt="False" ><![CDATA[trans1]]></Obj>
<Details plainTxt="False" ><![CDATA[Transaction "trans1" started.]]></Details>
<Time><![CDATA[3/29/2022 - 16:35:44]]></Time>
<TimeTick>1648551944</TimeTick>
<NodeArgs eType="Transaction" icon="4" nRep="7" nType="Start Transaction" Source="Action1" SourceLine="2" >
<Disp><![CDATA[trans1]]></Disp>
</NodeArgs>
</Step>
<Step rID="T5">
<Obj plainTxt="False" ><![CDATA[SystemUtil]]></Obj>
<Details plainTxt="False" ><![CDATA[SystemUtil]]></Details>
<Time><![CDATA[3/29/2022 - 16:36:00]]></Time>
<TimeTick>1648551960</TimeTick>
<Step rID="T6">
<Obj plainTxt="False" ><![CDATA[Run "C:\Program Files (x86)\HPE\Unified Functional Testing\samples\Flights Application\FlightsGUI.exe",1]]></Obj>
<Details plainTxt="False" ><![CDATA[Run "C:\Program Files (x86)\HPE\Unified Functional Testing\samples\Flights Application\FlightsGUI.exe",1]]></Details>
<Time><![CDATA[3/29/2022 - 16:36:00]]></Time>
<TimeTick>1648551960</TimeTick>
<NodeArgs eType="Replay" icon="5" nRep="11" status="Passed" >
<Disp><![CDATA[Run "C:\Program Files (x86)\HPE\Unified Functional Testing\samples\Flights Application\FlightsGUI.exe",1]]></Disp>
</NodeArgs>
</Step>
<NodeArgs eType="Replay" icon="5" nRep="10" status="Passed" >
<Disp><![CDATA[SystemUtil]]></Disp>
</NodeArgs>
</Step>
<Step rID="T7">
<Obj plainTxt="False" ><![CDATA[HPE MyFlight Sample Applicatio]]></Obj>
<Details plainTxt="False" ><![CDATA[WpfWindow]]></Details>
<Time><![CDATA[3/29/2022 - 16:36:02]]></Time>
<TimeTick>1648551962</TimeTick>
<Step rID="T8">
<Obj plainTxt="False" ><![CDATA[agentName.Set]]></Obj>
<Details plainTxt="False" ><![CDATA["john"]]></Details>
<Time><![CDATA[3/29/2022 - 16:36:02]]></Time>
<TimeTick>1648551962</TimeTick>
<NodeArgs eType="Replay" icon="7" nRep="16" >
<Disp><![CDATA[agentName.Set]]></Disp>
</NodeArgs>
</Step>
<Step rID="T9">
<Obj plainTxt="False" ><![CDATA[password.Set]]></Obj>
<Details plainTxt="False" ><![CDATA["hp"]]></Details>
<Time><![CDATA[3/29/2022 - 16:36:04]]></Time>
<TimeTick>1648551964</TimeTick>
<NodeArgs eType="Replay" icon="7" nRep="18" >
<Disp><![CDATA[password.Set]]></Disp>
</NodeArgs>
</Step>
<Step rID="T10">
<Obj plainTxt="False" ><![CDATA[OK.Click]]></Obj>
<Details plainTxt="False" ><![CDATA[]]></Details>
<Time><![CDATA[3/29/2022 - 16:36:05]]></Time>
<TimeTick>1648551965</TimeTick>
<NodeArgs eType="Replay" icon="8" nRep="20" >
<Disp><![CDATA[OK.Click]]></Disp>
</NodeArgs>
</Step>
<Step rID="T11">
<Obj plainTxt="False" ><![CDATA[HPE MyFlight Sample Applicatio.Close]]></Obj>
<Details plainTxt="False" ><![CDATA[]]></Details>
<Time><![CDATA[3/29/2022 - 16:36:10]]></Time>
<TimeTick>1648551970</TimeTick>
<NodeArgs eType="Replay" icon="6" nRep="22" >
<Disp><![CDATA[HPE MyFlight Sample Applicatio.Close]]></Disp>
</NodeArgs>
</Step>
<Step rID="T12">
<Obj plainTxt="False" ><![CDATA[SystemUtil]]></Obj>
<Details plainTxt="False" ><![CDATA[SystemUtil]]></Details>
<Time><![CDATA[3/29/2022 - 16:36:24]]></Time>
<TimeTick>1648551984</TimeTick>
<Step rID="T13">
<Obj plainTxt="False" ><![CDATA[Run "C:\Program Files (x86)\HPE\Unified Functional Testing\samples\Flights Application\FlightsGUI.exe",1]]></Obj>
<Details plainTxt="False" ><![CDATA[Run "C:\Program Files (x86)\HPE\Unified Functional Testing\samples\Flights Application\FlightsGUI.exe",1]]></Details>
<Time><![CDATA[3/29/2022 - 16:36:24]]></Time>
<TimeTick>1648551984</TimeTick>
<NodeArgs eType="Replay" icon="5" nRep="26" status="Passed" >
<Disp><![CDATA[Run "C:\Program Files (x86)\HPE\Unified Functional Testing\samples\Flights Application\FlightsGUI.exe",1]]></Disp>
</NodeArgs>
</Step>
<NodeArgs eType="Replay" icon="5" nRep="25" status="Passed" >
<Disp><![CDATA[SystemUtil]]></Disp>
</NodeArgs>
</Step>
<Step rID="T14">
<Obj plainTxt="False" ><![CDATA[agentName.Set]]></Obj>
<Details plainTxt="False" ><![CDATA["john"]]></Details>
<Time><![CDATA[3/29/2022 - 16:36:27]]></Time>
<TimeTick>1648551987</TimeTick>
<NodeArgs eType="Replay" icon="7" nRep="30" >
<Disp><![CDATA[agentName.Set]]></Disp>
</NodeArgs>
</Step>
<Step rID="T15">
<Obj plainTxt="False" ><![CDATA[password.Set]]></Obj>
<Details plainTxt="False" ><![CDATA["hp"]]></Details>
<Time><![CDATA[3/29/2022 - 16:36:27]]></Time>
<TimeTick>1648551987</TimeTick>
<NodeArgs eType="Replay" icon="7" nRep="32" >
<Disp><![CDATA[password.Set]]></Disp>
</NodeArgs>
</Step>
<Step rID="T16">
<Obj plainTxt="False" ><![CDATA[OK.Click]]></Obj>
<Details plainTxt="False" ><![CDATA[]]></Details>
<Time><![CDATA[3/29/2022 - 16:36:28]]></Time>
<TimeTick>1648551988</TimeTick>
<NodeArgs eType="Replay" icon="8" nRep="34" >
<Disp><![CDATA[OK.Click]]></Disp>
</NodeArgs>
</Step>
<Step rID="T17">
<Obj plainTxt="False" ><![CDATA[WpfTabStrip.Select]]></Obj>
<Details plainTxt="False" ><![CDATA["SEARCH ORDER"]]></Details>
<Time><![CDATA[3/29/2022 - 16:36:33]]></Time>
<TimeTick>1648551993</TimeTick>
<NodeArgs eType="Replay" icon="9" nRep="36" >
<Disp><![CDATA[WpfTabStrip.Select]]></Disp>
</NodeArgs>
</Step>
<Step rID="T18">
<Obj plainTxt="False" ><![CDATA[byNumberRadio.Set]]></Obj>
<Details plainTxt="False" ><![CDATA[]]></Details>
<Time><![CDATA[3/29/2022 - 16:36:34]]></Time>
<TimeTick>1648551994</TimeTick>
<NodeArgs eType="Replay" icon="10" nRep="38" >
<Disp><![CDATA[byNumberRadio.Set]]></Disp>
</NodeArgs>
</Step>
<Step rID="T19">
<Obj plainTxt="False" ><![CDATA[byNumberWatermark.Set]]></Obj>
<Details plainTxt="False" ><![CDATA["7"]]></Details>
<Time><![CDATA[3/29/2022 - 16:36:35]]></Time>
<TimeTick>1648551995</TimeTick>
<NodeArgs eType="Replay" icon="7" nRep="40" >
<Disp><![CDATA[byNumberWatermark.Set]]></Disp>
</NodeArgs>
</Step>
<Step rID="T20">
<Obj plainTxt="False" ><![CDATA[SEARCH.Click]]></Obj>
<Details plainTxt="False" ><![CDATA[]]></Details>
<Time><![CDATA[3/29/2022 - 16:36:36]]></Time>
<TimeTick>1648551996</TimeTick>
<NodeArgs eType="Replay" icon="8" nRep="42" >
<Disp><![CDATA[SEARCH.Click]]></Disp>
</NodeArgs>
</Step>
<Step rID="T21">
<Obj plainTxt="False" ><![CDATA[HPE MyFlight Sample Applicatio.Close]]></Obj>
<Details plainTxt="False" ><![CDATA[]]></Details>
<Time><![CDATA[3/29/2022 - 16:36:42]]></Time>
<TimeTick>1648552002</TimeTick>
<NodeArgs eType="Replay" icon="6" nRep="44" >
<Disp><![CDATA[HPE MyFlight Sample Applicatio.Close]]></Disp>
</NodeArgs>
</Step>
<Step rID="T22">
<Obj plainTxt="False" ><![CDATA[SystemUtil]]></Obj>
<Details plainTxt="False" ><![CDATA[SystemUtil]]></Details>
<Time><![CDATA[3/29/2022 - 16:36:58]]></Time>
<TimeTick>1648552018</TimeTick>
<Step rID="T23">
<Obj plainTxt="False" ><![CDATA[Run "C:\Program Files (x86)\HPE\Unified Functional Testing\samples\Flights Application\FlightsGUI.exe",1]]></Obj>
<Details plainTxt="False" ><![CDATA[Run "C:\Program Files (x86)\HPE\Unified Functional Testing\samples\Flights Application\FlightsGUI.exe",1]]></Details>
<Time><![CDATA[3/29/2022 - 16:36:58]]></Time>
<TimeTick>1648552018</TimeTick>
<NodeArgs eType="Replay" icon="5" nRep="48" status="Passed" >
<Disp><![CDATA[Run "C:\Program Files (x86)\HPE\Unified Functional Testing\samples\Flights Application\FlightsGUI.exe",1]]></Disp>
</NodeArgs>
</Step>
<NodeArgs eType="Replay" icon="5" nRep="47" status="Passed" >
<Disp><![CDATA[SystemUtil]]></Disp>
</NodeArgs>
</Step>
<Step rID="T24">
<Obj plainTxt="False" ><![CDATA[agentName.Set]]></Obj>
<Details plainTxt="False" ><![CDATA["john"]]></Details>
<Time><![CDATA[3/29/2022 - 16:37:00]]></Time>
<TimeTick>1648552020</TimeTick>
<NodeArgs eType="Replay" icon="7" nRep="52" >
<Disp><![CDATA[agentName.Set]]></Disp>
</NodeArgs>
</Step>
<Step rID="T25">
<Obj plainTxt="False" ><![CDATA[password.Set]]></Obj>
<Details plainTxt="False" ><![CDATA["hp"]]></Details>
<Time><![CDATA[3/29/2022 - 16:37:01]]></Time>
<TimeTick>1648552021</TimeTick>
<NodeArgs eType="Replay" icon="7" nRep="54" >
<Disp><![CDATA[password.Set]]></Disp>
</NodeArgs>
</Step>
<Step rID="T26">
<Obj plainTxt="False" ><![CDATA[OK.Click]]></Obj>
<Details plainTxt="False" ><![CDATA[]]></Details>
<Time><![CDATA[3/29/2022 - 16:37:02]]></Time>
<TimeTick>1648552022</TimeTick>
<NodeArgs eType="Replay" icon="8" nRep="56" >
<Disp><![CDATA[OK.Click]]></Disp>
</NodeArgs>
</Step>
<Step rID="T27">
<Obj plainTxt="False" ><![CDATA[WpfTabStrip.Select]]></Obj>
<Details plainTxt="False" ><![CDATA["SEARCH ORDER"]]></Details>
<Time><![CDATA[3/29/2022 - 16:37:08]]></Time>
<TimeTick>1648552028</TimeTick>
<NodeArgs eType="Replay" icon="9" nRep="58" >
<Disp><![CDATA[WpfTabStrip.Select]]></Disp>
</NodeArgs>
</Step>
<Step rID="T28">
<Obj plainTxt="False" ><![CDATA[byNumberRadio.Set]]></Obj>
<Details plainTxt="False" ><![CDATA[]]></Details>
<Time><![CDATA[3/29/2022 - 16:37:08]]></Time>
<TimeTick>1648552028</TimeTick>
<NodeArgs eType="Replay" icon="10" nRep="60" >
<Disp><![CDATA[byNumberRadio.Set]]></Disp>
</NodeArgs>
</Step>
<Step rID="T29">
<Obj plainTxt="False" ><![CDATA[byNumberWatermark.Set]]></Obj>
<Details plainTxt="False" ><![CDATA["7"]]></Details>
<Time><![CDATA[3/29/2022 - 16:37:09]]></Time>
<TimeTick>1648552029</TimeTick>
<NodeArgs eType="Replay" icon="7" nRep="62" >
<Disp><![CDATA[byNumberWatermark.Set]]></Disp>
</NodeArgs>
</Step>
<Step rID="T30">
<Obj plainTxt="False" ><![CDATA[SEARCH.Click]]></Obj>
<Details plainTxt="False" ><![CDATA[]]></Details>
<Time><![CDATA[3/29/2022 - 16:37:10]]></Time>
<TimeTick>1648552030</TimeTick>
<NodeArgs eType="Replay" icon="8" nRep="64" >
<Disp><![CDATA[SEARCH.Click]]></Disp>
</NodeArgs>
</Step>
<Step rID="T31">
<Obj plainTxt="False" ><![CDATA[numOfTicketsCombo.Select]]></Obj>
<Details plainTxt="False" ><![CDATA["5"]]></Details>
<Time><![CDATA[3/29/2022 - 16:37:16]]></Time>
<TimeTick>1648552036</TimeTick>
<NodeArgs eType="Replay" icon="11" nRep="66" >
<Disp><![CDATA[numOfTicketsCombo.Select]]></Disp>
</NodeArgs>
</Step>
<Step rID="T32">
<Obj plainTxt="False" ><![CDATA[updateBtn]]></Obj>
<Details plainTxt="False" ><![CDATA[Object&nbsp;is&nbsp;disabled]]></Details>
<Time><![CDATA[3/29/2022 - 16:37:17]]></Time>
<TimeTick>1648552037</TimeTick>
<Step rID="T33">
<Obj plainTxt="False" ><![CDATA[updateBtn]]></Obj>
<Details plainTxt="False" ><![CDATA[Object's physical description:<br>Text = <br>devname = updateBtn<br>]]></Details>
<Time><![CDATA[3/29/2022 - 16:37:17]]></Time>
<TimeTick>1648552037</TimeTick>
<NodeArgs eType="Replay" icon="12" nRep="68" status="Warning" nType="Description" >
<Disp><![CDATA[updateBtn]]></Disp>
</NodeArgs>
</Step>
<NodeArgs eType="Replay" icon="8" nRep="67" status="Failed" nType="Run Error" >
<Disp><![CDATA[updateBtn]]></Disp>
</NodeArgs>
</Step>
<NodeArgs eType="Context" icon="6" nRep="15" status="Failed" >
<Disp><![CDATA[HPE MyFlight Sample Applicatio]]></Disp>
</NodeArgs>
</Step>
<Step rID="T34">
<Obj plainTxt="False" ><![CDATA[HPE MyFlight Sample Applicatio]]></Obj>
<Details plainTxt="False" ><![CDATA[WpfWindow]]></Details>
<Time><![CDATA[3/29/2022 - 16:37:17]]></Time>
<TimeTick>1648552037</TimeTick>
<Step rID="T35">
<Obj plainTxt="False" ><![CDATA[Run Error]]></Obj>
<Details plainTxt="False" ><![CDATA[Object is disabled<BR/>Function file: C:\Users\Admin\Desktop\Capgemini Study Material\Keyboard_driven_framework\FunctionLibrary\LibraryFram1.qfl<BR/>Line (29): &quot;WpfWindow(&quot;HPE MyFlight Sample Applicatio&quot;).WpfButton(&quot;updateBtn&quot;).Click&quot;.]]></Details>
<Time><![CDATA[3/29/2022 - 16:37:18]]></Time>
<TimeTick>1648552038</TimeTick>
<NodeArgs eType="Replay" icon="12" nRep="70" status="Failed" Source="C:\Users\Admin\Desktop\Capgemini Study Material\Keyboard_driven_framework\FunctionLibrary\LibraryFram1.qfl" SourceLine="28" >
<Disp><![CDATA[Run Error]]></Disp>
<BtmPane vType="ViewerGen.SSViewerGen" >
<Path><![CDATA[ZIP::Act1\Row0\ssf8.xml]]></Path>
<ASHilite><![CDATA[3672208]]></ASHilite>
</BtmPane>
</NodeArgs>
</Step>
<Step rID="T36">
<Obj plainTxt="False" ><![CDATA[HPE MyFlight Sample Applicatio.Close]]></Obj>
<Details plainTxt="False" ><![CDATA[]]></Details>
<Time><![CDATA[3/29/2022 - 16:37:29]]></Time>
<TimeTick>1648552049</TimeTick>
<NodeArgs eType="Replay" icon="6" nRep="72" >
<Disp><![CDATA[HPE MyFlight Sample Applicatio.Close]]></Disp>
</NodeArgs>
</Step>
<Step rID="T37">
<Obj plainTxt="False" ><![CDATA[trans1]]></Obj>
<Details plainTxt="False" ><![CDATA[Transaction "trans1" ended with "Fail" status (Total Duration: 108.4394 sec).]]></Details>
<Time><![CDATA[3/29/2022 - 16:37:33]]></Time>
<TimeTick>1648552053</TimeTick>
<NodeArgs eType="Transaction" icon="13" nRep="73" status="Warning" nType="End Transaction" Source="Action1" SourceLine="56" >
<Disp><![CDATA[trans1]]></Disp>
</NodeArgs>
</Step>
<NodeArgs eType="Context" icon="6" nRep="69" status="Failed" Source="C:\Users\Admin\Desktop\Capgemini Study Material\Keyboard_driven_framework\FunctionLibrary\LibraryFram1.qfl" SourceLine="-1" >
<Disp><![CDATA[HPE MyFlight Sample Applicatio]]></Disp>
<BtmPane vType="ViewerGen.SSViewerGen" >
<Path><![CDATA[ZIP::Act1\Row0\ssf7.xml]]></Path>
<ASHilite><![CDATA[3672208]]></ASHilite>
</BtmPane>
</NodeArgs>
</Step>
<Summary sTime="3/29/2022 - 16:35:44" eTime="3/29/2022 - 16:37:33" passed="3" failed="2" warnings="2" ></Summary>
<NodeArgs eType="StartAction" icon="3" nRep="6" status="Failed" >
<Disp><![CDATA[Action1 Summary]]></Disp>
</NodeArgs>
</Action>
<Action rID="T38">
<AName><![CDATA[Action2]]></AName>
<Summary sTime="3/29/2022 - 16:37:33" eTime="3/29/2022 - 16:37:34" passed="0" failed="0" warnings="0" ></Summary>
<NodeArgs eType="StartAction" icon="3" nRep="75" >
<Disp><![CDATA[Action2 Summary]]></Disp>
</NodeArgs>
</Action>
<Action rID="T39">
<AName><![CDATA[Action3]]></AName>
<Summary sTime="3/29/2022 - 16:37:35" eTime="3/29/2022 - 16:37:35" passed="0" failed="0" warnings="0" ></Summary>
<NodeArgs eType="StartAction" icon="3" nRep="77" >
<Disp><![CDATA[Action3 Summary]]></Disp>
</NodeArgs>
</Action>
<Summary sTime="3/29/2022 - 16:35:38" eTime="3/29/2022 - 16:37:35" passed="3" failed="2" warnings="2" ></Summary>
<NodeArgs eType="StartTest" icon="1" nRep="3" status="Failed" >
<Disp><![CDATA[Test Driver Summary]]></Disp>
</NodeArgs>
</Doc>
</Report>